uid,area,titulo,promesa,avance_total,boletin,titulo_proyecto,link,1° tramite,veto,insistencia,2°-3° tramite,comision_mixta,tribunal_constitucional,aprobacion_presidencial,promulgado,rechazado/retirado,nombre_avance,avance,simple,suma,inmediata,total_urgencias,ja_porque
105,Trabajo y Previsión Social,Crear incentivos para los planes de ahorro previsional voluntario,Crear nuevos incentivos para los planes de ahorro previsional voluntario,70%,12212-13,"Mejora pensiones del sistema de pensiones solidarias y del sistema de pensiones de capitalización individual, crea nuevos beneficios de pensión para la clase media y las mujeres, crea un subsidio y seguro de dependencia, e introduce modificaciones en los cuerpos legales que indica",http://www.senado.cl/appsenado/templates/tramitacion/index.php?boletin_ini=12212-13,,,,1,,,,,,Segundo Tramite,"0,7",6,17,3,26,El proyecto de ley asociado se encuentra en segundo trámite constitucional
106,Trabajo y Previsión Social,Autorizar el retiro de un monto de libre disposición,Autorizar el retiro de un monto de libre disposición a quienes posterguen la edad de jubilación equivalente al 50% del mayor ahorro logrado fruto de dicha decisión.,70%,12212-13,"Mejora pensiones del sistema de pensiones solidarias y del sistema de pensiones de capitalización individual, crea nuevos beneficios de pensión para la clase media y las mujeres, crea un subsidio y seguro de dependencia, e introduce modificaciones en los cuerpos legales que indica",http://www.senado.cl/appsenado/templates/tramitacion/index.php?boletin_ini=12212-13,,,,1,,,,,,Segundo Tramite,"0,7",6,17,3,26,El proyecto de ley asociado se encuentra en segundo trámite constitucional
107,Trabajo y Previsión Social,Levantar las restricciones al cambio de fondo de pensiones, Levantando las restricciones al cambio de fondo (de pensiones),70%,12212-13,"Mejora pensiones del sistema de pensiones solidarias y del sistema de pensiones de capitalización individual, crea nuevos beneficios de pensión para la clase media y las mujeres, crea un subsidio y seguro de dependencia, e introduce modificaciones en los cuerpos legales que indica","http://www.senado.cl/appsenado/templates/tramitacion/index.php?boletin_ini=12212-13

",,,,1,,,,,,Segundo Tramite,"0,7",5,17,3,25,El proyecto de ley asociado se encuentra en segundo trámite constitucional
108,Equidad de Género,Permitir a la mujer administrar la sociedad conyugal y/o sus bienes propios,Reimpulsar el proyecto que modifica el régimen de sociedad conyugal permitiendo a la mujer administrar la sociedad y/o sus bienes propios. ,70%,7727-18,"Modifica Código Civil y otras leyes, en el Régimen de Sociedad Conyugal.",http://www.senado.cl/appsenado/templates/tramitacion/index.php?boletin_ini=7727-18,,,,1,,,,,,Segundo Tramite,"0,7",2,2,,4,El proyecto de ley asociado se encuentra en segundo trámite constitucional
109,Equidad de Género,Eliminar impedimento legal de contraer segundas nupcias antes de los 270 ,"Terminar con el impedimento legal de contraer segundas nupcias antes de los 270 días desde la disolución del vínculo por divorcio, nulidad o muerte.",70%,11126-07,Modifica el Código Civil en el sentido de suprimir el impedimento de segundas nupcias,http://www.senado.cl/appsenado/templates/tramitacion/index.php?boletin_ini=11126-07,,,,1,,,,,,Segundo Tramite,"0,7",14,9,4,27,El proyecto de ley asociado se encuentra en segundo trámite constitucional
110,Trabajo y Previsión Social,Mejorar el subsidio al empleo de la mujer,"Mejorar el subsidio al empleo de la mujer, entregando un mayor aporte dependiendo del tamaño de la familia.",0%,,,,,,,,,,,,,,0,,,,0,No se conocen proyectos de ley asociados a esta promesa.
111,Equidad de Género, Ley sobre el Derecho de las Mujeres a una Vida Libre de Violencia.,Impulsar el pronto despacho del proyecto de ley sobre el Derecho de las Mujeres a una Vida Libre de Violencia.,70%,11077-07,Sobre el derecho de las mujeres a una vida libre de violencia,http://www.senado.cl/appsenado/templates/tramitacion/index.php?boletin_ini=11077-07,,,,1,,,,,,Segundo Tramite,"0,7",8,8,,16,El proyecto de ley asociado se encuentra en segundo trámite constitucional
112,Equidad de Género,Poner urgencia a los proyectos sobre violencia en el pololeo,Desarrollar una agenda corta de combate a la violencia contra la mujer poniendo urgencia a los proyectos paralizados en el Congreso sobre violencia en el pololeo,70%,8851-18,"Modifica Ley de Violencia Intrafamiliar y otros cuerpos legales y, establece ley sobre violencia en las relaciones íntimas de pareja sin convivencia.",http://www.senado.cl/appsenado/templates/tramitacion/index.php?boletin_ini=8851-18,,,,1,,,,,,Segundo Tramite,"0,7",4,5,,9,El proyecto de ley asociado se encuentra en segundo trámite constitucional
113,Equidad de Género,Poner urgencia a los proyectos sobre medios electrónicos para medidas de protección,Desarrollar una agenda corta de combate a la violencia contra la mujer poniendo urgencia a los proyectos paralizados en el Congreso sobre medios electrónicos para medidas de protección,0%,,,,,,,,,,,,,,0,,,,0,No se conocen proyectos de ley asociados a esta promesa.
114,Equidad de Género,agenda corta de combate a la violencia contra la mujer,Desarrollar una agenda corta de combate a la violencia contra la mujer poniendo urgencia a los proyectos paralizados en el Congreso - Tipificación del femicidio y de otros delitos contra las mujeres,100%,11970-34,Modifica el Código Penal en materia de tipificación del femicidio y de otros delitos contra las mujeres,http://www.senado.cl/appsenado/templates/tramitacion/index.php?boletin_ini=11970-34,,,,,,,,1,,Promulgado,1,4,15,,19,El proyecto de ley asociado se encuentra publicado y es Ley de la República.
115,Equidad de Género,agenda corta de combate a la violencia contra la mujer,Desarrollar una agenda corta de combate a la violencia contra la mujer poniendo urgencia a los proyectos paralizados en el Congreso - Sancionar la difusión no consentida de imágenes o contenido de connotación sexual,70%,11923-25,"Modifica el Código Penal para sancionar la difusión no consentida de imágenes o contenido de connotación sexual, obtenidas con ocasión de la vida en pareja sostenida entre el hechor y su víctima",http://www.senado.cl/appsenado/templates/tramitacion/index.php?boletin_ini=11923-25,,,,1,,,,,,Segundo Tramite,"0,7",,,,0,El proyecto de ley asociado se encuentra en segundo trámite constitucional
116,Equidad de Género,agenda corta de combate a la violencia contra la mujer,Desarrollar una agenda corta de combate a la violencia contra la mujer poniendo urgencia a los proyectos paralizados en el Congreso - Tipifica el delito de acoso sexual en público.,100%,7606-07,Tipifica el delito de acoso sexual en público.,http://www.senado.cl/appsenado/templates/tramitacion/index.php?boletin_ini=7606-07,,,,,,,,1,,Promulgado,1,3,,,3,El proyecto de ley asociado se encuentra publicado y es Ley de la República.
117,Equidad de Género,Aumento de penas en el contexto de violencia intrafamiliar,Aumentar las penas del delito de maltrato habitual y de lesiones cuando se produce en un contexto de violencia intrafamiliar,70%,8851-18,"Modifica Ley de Violencia Intrafamiliar y otros cuerpos legales y, establece ley sobre violencia en las relaciones íntimas de pareja sin convivencia.",http://www.senado.cl/appsenado/templates/tramitacion/index.php?boletin_ini=8851-18,,,,1,,,,,,Segundo Tramite,"0,7",4,5,,9,El proyecto de ley asociado se encuentra en segundo trámite constitucional
118,Equidad de Género,Facilitar la afectación del bien familiar,"Garantizar a la mujer un hogar donde vivir con sus hijos, facilitando la afectación del bien familiar. ",0%,,,,,,,,,,,,,,0,,,,0,No se conocen proyectos de ley asociados a esta promesa.
119,Salud,Modernizar Fonasa,"Modernizar Fonasa desde la lógica de un fondo a una de seguro. El foco estará puesto en la entrega de los servicios comprometidos de manera oportuna y con la mejor calidad posible.
o Impulsar una nueva gobernanza mediante un directorio técnico y avanzar desde el financiamiento de instituciones hacia el de soluciones de salud para los usuarios.",40%,13178-11,Reforma el Fondo Nacional de Salud y crea un Plan de Salud Universal,https://www.senado.cl/appsenado/templates/tramitacion/index.php?,1,,,,,,,,,Primer Tramite,"0,4",,,,0,El proyecto de ley asociado se encuentra en primer trámite constitucional
120,Salud, Innovacion institucional en la Subsecretaría de Redes Asistenciales,"Reorganizar la atención de salud, mediante las siguientes innovaciones institucionales:Transformar la Subsecretaría de Redes Asistenciales en una entidad independiente, con un Directorio Nacional de Atención de Salud Pública elegido por Alta Dirección Pública. Su función principal será monitorear el funcionamiento de la red de prestadores estatales y designar, evaluar y remover a los gobiernos superiores de los Servicios de Salud y hospitales, cuando corresponda.",0%,,,,,,,,,,,,,,0,,,,0,No se conocen proyectos de ley asociados a esta promesa.
121,Salud,Modernizar los Servicios de Salud,"Modernizar los Servicios de Salud, incluyendo cambios a sus estructuras administrativas y gobiernos corporativos, los que se renovarán en función del desempeño y con independencia del ciclo político. Los servicios contarán con directores ejecutivos que dependerán de los directorios y su objetivo central será mejorar la atención de los usuarios.",0%,,,,,,,,,,,,,,0,,,,0,No se conocen proyectos de ley asociados a esta promesa.
122,Salud,Reformar los esquemas de seguros ,"Reformar gradualmente los esquemas de seguros para avanzar hacia un sistema que garantice asequibilidad, competencia, transparencia y libre afiliación poniendo fin a las preexistencias.",0%,,,,,,,,,,,,,,0,,,,0,No se conocen proyectos de ley asociados a esta promesa.
123,Salud,Crear un Plan de Salud Universal,"Terminar con las discriminaciones en el acceso por edad, género o preexistencias en Isapres, mediante la creación de un Plan de Salud Universal.",70%,8105 -11,"Modifica el Sistema Privado de Salud, incorporando un plan garantizado.","http://www.senado.cl/appsenado/templates/tramitacion/index.php?boletin_ini=8105-11
",,,,1,,,,,,Segundo Tramite,"0,7",10,28,1,39,El proyecto de ley asociado se encuentra en segundo trámite constitucional
124,Salud,Crear un sistema que estimule a independientes e informales a cotizar para salud,Crear un sistema que estimule a independientes e informales a cotizar para salud.,100%,12002-13,Modifica las normas para la incorporación de los trabajadores a honorarios del sector público y privado e independientes a los regímenes de protección social.,http://www.senado.cl/appsenado/templates/tramitacion/index.php?boletin_ini=12002-13,,,,,,,,1,,Promulgado,1,,,,0,El proyecto de ley asociado se encuentra publicado y es Ley de la República.
125,Salud,Nuevo seguro social de salud,"Avanzar a mediano plazo hacia un nuevo seguro social de salud, con un plan base para todos los chilenos, independiente del sistema previsional.",0%,,,,,,,,,,,,,,0,,,,0,No se conocen proyectos de ley asociados a esta promesa.
126,Salud,Mayor competencia en la industria de laboratorios y farmacéutica,Introducir más competencia en la industria de laboratorios y farmacéutica y potenciar el uso de medicamentos genéricos bioequivalentes.,70%,9914-11,Modifica el Código Sanitario para regular los medicamentos bioequivalentes genéricos y evitar la integración vertical de laboratorios y farmacias.,https://www.senado.cl/appsenado/templates/tramitacion/index.php?boletin_ini=9914-11,,,,,1,,,,,Comisión Mixta,"0,7",3,29,3,35,El proyecto de ley asociado se encuentra en segundo trámite constitucional
127,Salud,Nuevo comparador online de precios de farmacos,"Nuevo comparador online de precios www.tufarmacia.gob.cl, para que todas las personas sepan en qué farmacia pueden encontrar los medicamentos más baratos del mercado, incluyendo las alternativas de genéricos bioequivalentes disponibles.",70%,9914-11,Modifica el Código Sanitario para regular los medicamentos bioequivalentes genéricos y evitar la integración vertical de laboratorios y farmacias.,https://www.senado.cl/appsenado/templates/tramitacion/index.php?boletin_ini=9914-11,,,,,1,,,,,Comisión Mixta,"0,7",3,29,3,35,El proyecto de ley asociado se encuentra en segundo trámite constitucional
128,Salud,Observatorio nacional e internacional de medicamentos y otros dispositivos médicos.,Observatorio nacional e internacional de medicamentos y otros dispositivos médicos.,70%,9914-11,Modifica el Código Sanitario para regular los medicamentos bioequivalentes genéricos y evitar la integración vertical de laboratorios y farmacias.,https://www.senado.cl/appsenado/templates/tramitacion/index.php?boletin_ini=9914-11,,,,,1,,,,,Comisión Mixta,"0,7",3,29,3,35,El proyecto de ley asociado se encuentra en segundo trámite constitucional
129,Salud,Perfeccionar la ley Ricarte Soto,"Perfeccionar la ley Ricarte Soto redefiniendo el método de priorización, incorporando el riesgo vital y mejorando el registro de pacientes.",0%,,,,,,,,,,,,,,0,,,,0,No se conocen proyectos de ley asociados a esta promesa.
130,Salud,Constituir el Consejo Nacional de Cáncer,"Constituir el Consejo Nacional de Cáncer, cuyo propósito principal será velar por el fortalecimiento de una política nacional de cáncer de carácter permanente.",70%,12292-11,Establece la Ley Nacional del Cáncer.,http://www.senado.cl/appsenado/templates/tramitacion/index.php?boletin_ini=12292-11,,,,1,,,,,,Segundo Tramite,"0,7",1,15,,16,El proyecto de ley asociado se encuentra en segundo trámite constitucional
131,Desarrollo Social,Subsidio de apoyo para los adultos mayores con discapacidad,Impulsar nuevos mecanismos de apoyo para las familias: se estudiará la creación de un subsidio de apoyo para la dependencia de los adultos mayores con discapacidad,70%,12212-13,"Mejora pensiones del sistema de pensiones solidarias y del sistema de pensiones de capitalización individual, crea nuevos beneficios de pensión para la clase media y las mujeres, crea un subsidio y seguro de dependencia, e introduce modificaciones en los cuerpos legales que indica",http://www.senado.cl/appsenado/templates/tramitacion/index.php?boletin_ini=12212-13,,,,1,,,,,,Segundo Tramite,"0,7",5,17,1,23,El proyecto de ley asociado se encuentra en segundo trámite constitucional
132,Desarrollo Social,Mercado laboral inclusivo,"Fomentar un mercado laboral inclusivo para las personas con discapacidad, incluyendo a los cuidadores en la cuota de la nueva Ley de Inclusión Laboral, facilitando el acceso a los sistemas de capacitación de SENCE y estableciendo mecanismos que permitan compatibilizar el trabajo y las terapias de rehabilitación.",0%,,,,,,,,,,,,,,0,,,,0,No se conocen proyectos de ley asociados a esta promesa.
133,Desarrollo Social,Perfeccionar la legislación de seguridad social en materia de discapacidad,"Perfeccionar la legislación de seguridad social para las personas con discapacidad, de forma que los jóvenes con discapacidad no pierdan los beneficios de su plan de salud familiar por el hecho de trabajar. También se flexibilizarán los requisitos para mantener el derecho al Pilar Solidario en el caso de quienes opten por trabajar. ",0%,,,,,,,,,,,,,,0,,,,0,No se conocen proyectos de ley asociados a esta promesa.
134,Pueblos Indígenas,Reconocer constitucionalmente a los pueblos indígenas,"Reconocer constitucionalmente a los pueblos indígenas, impulsando el diálogo con los mismos a través de los mecanismos de participación y consulta respectivos.",0%,,,,,,,,,,,,,,0,,,,0,No se conocen proyectos de ley asociados a esta promesa.
135,Pueblos Indígenas,Crear el Consejo Nacional de Pueblos Indígenas y los Consejos de cada pueblo,"Crear el Consejo Nacional de Pueblos Indígenas y los Consejos de cada pueblo, como instancias de representación y participación de los pueblos indígenas.",70%,10526-06,Crea el Consejo Nacional y los Consejos de Pueblos Indígenas,http://www.senado.cl/appsenado/templates/tramitacion/index.php?boletin_ini=10526-06,,,,1,,,,,,Segundo Tramite,"0,7",2,10,,12,El proyecto de ley asociado se encuentra en segundo trámite constitucional
136,Pueblos Indígenas,Establecer una Agencia de Desarrollo Indígena,"Establecer una Agencia de Desarrollo Indígena en ese Ministerio, que sea la continuadora de la CONADI, con responsabilidad por la ejecución de las políticas, planes y programas para las personas y comunidades indígenas.",70%,10687-06,Crea el Ministerio de Pueblos Indígenas,http://www.senado.cl/appsenado/templates/tramitacion/index.php?boletin_ini=10687-06,,,,1,,,,,,Segundo Tramite,"0,7",,,,0,El proyecto de ley asociado se encuentra en segundo trámite constitucional
137,Pueblos Indígenas,Crear Corporaciones Territoriales de Desarrollo Indígena,"Crear Corporaciones Territoriales de Desarrollo Indígena que sean garantes y acompañen los acuerdos entre el Estado y los indígenas, y entre privados y comunidades, para desarrollar proyectos en determinados territorios.",0%,,,,,,,,,,,,,,0,,,,0,No se conocen proyectos de ley asociados a esta promesa.
138,Pueblos Indígenas,Modificar la ley indígena en materia de disposicion de sus tierras,"Modificar la ley indígena para potenciar el uso productivo de las tierras entregadas a los miembros del pueblo mapuche reduciendo o eliminando las prohibiciones de vender, hipotecar, arrendar, o disponer de sus tierras.",0%,,,,,,,,,,,,,,0,,,,0,No se conocen proyectos de ley asociados a esta promesa.
139,Justicia y Derechos Humanos,Actualizar el proyecto de Ley de Migración y Extranjería,Se impulsará y actualizará el proyecto de Ley de Migración y Extranjería,70%,8970-06,Ley de Migración y Extranjería.,http://www.senado.cl/appsenado/templates/tramitacion/index.php?boletin_ini=8970-06,,,,1,,,,,,Segundo Tramite,"0,7",5,14,,19,El proyecto de ley asociado se encuentra en segundo trámite constitucional
140,Justicia y Derechos Humanos,Establecer por ley el Consejo de Política Migratoria ,Mejorar la institucionalidad estableciendo por ley el Consejo de Política Migratoria y fortaleciendo a la Subsecretaría del Interior y las Gobernaciones como autoridades migratorias.,70%,8970-06,Ley de Migración y Extranjería.,http://www.senado.cl/appsenado/templates/tramitacion/index.php?boletin_ini=8970-07,,,,1,,,,,,Segundo Tramite,"0,7",5,14,,19,El proyecto de ley asociado se encuentra en segundo trámite constitucional
141,Justicia y Derechos Humanos,Visas específicas para capital humano avanzado,"Ampliar las opciones que se le ofrecen al migrante, con visas específicas para personas con capital humano avanzado que Chile necesita, como médicos especialistas y talentos excepcionales.",70%,8970-06,Ley de Migración y Extranjería.,http://www.senado.cl/appsenado/templates/tramitacion/index.php?boletin_ini=8970-08,,,,1,,,,,,Segundo Tramite,"0,7",5,14,,19,El proyecto de ley asociado se encuentra en segundo trámite constitucional
142,Trabajo y Previsión Social,Obligacion para los extranjeros de cotizar en el sistema chileno de pensiones,"Exigir a todo extranjero que trabaje en Chile cotizar en el sistema chileno de pensiones, sin perjuicio de poder retirar sus fondos previsionales en caso de dejar el país para destinarlos a fines previsionales en su país de origen.",0%,,,,,,,,,,,,,,0,,,,0,No se conocen proyectos de ley asociados a esta promesa.
143,Justicia y Derechos Humanos,Igualdad para el migrante regular en el acceso al sistema de salud,Establecer expresamente que los extranjeros en situación migratoria regular tendrán acceso al sistema de salud en condiciones iguales a los nacionales.,70%,8970-06,Ley de Migración y Extranjería.,http://www.senado.cl/appsenado/templates/tramitacion/index.php?boletin_ini=8970-06,,,,1,,,,,,Segundo Tramite,"0,7",5,14,,19,El proyecto de ley asociado se encuentra en segundo trámite constitucional
144,Justicia y Derechos Humanos,Garantía de acceso a educación a los niños extranjeros,"Mantener garantía de acceso a educación preescolar, básica y media a los niños extranjeros en las mismas condiciones que a los nacionales con independencia de su situación migratoria.",70%,8970-06,Ley de Migración y Extranjería.,http://www.senado.cl/appsenado/templates/tramitacion/index.php?boletin_ini=8970-06,,,,1,,,,,,Segundo Tramite,"0,7",5,14,,19,El proyecto de ley asociado se encuentra en segundo trámite constitucional
145,Justicia y Derechos Humanos,Agilizar la expulsión de extranjeros que incumplan las normas chilenas,"Hacer más expedita y menos burocrática la expulsión de aquellas personas que, no teniendo arraigo, incumplan gravemente las normas chilenas, sin perjuicio de los procesos judiciales que deban enfrentar en Chile.",70%,8970-06,Ley de Migración y Extranjería.,http://www.senado.cl/appsenado/templates/tramitacion/index.php?boletin_ini=8970-06,,,,1,,,,,,Segundo Tramite,"0,7",5,14,,19,El proyecto de ley asociado se encuentra en segundo trámite constitucional
146,Educación,Perfeccionar el sistema de revalidación y reconocimiento de títulos,Agilizar y perfeccionar el sistema de revalidación y reconocimiento de títulos de educación superior.,70%,8970-06,Ley de Migración y Extranjería.,http://www.senado.cl/appsenado/templates/tramitacion/index.php?boletin_ini=8970-06,,,,1,,,,,,Segundo Tramite,"0,7",5,14,,19,El proyecto de ley asociado se encuentra en segundo trámite constitucional
147,Seguridad Ciudadana,Modernizar los sistemas de auditoría y selección de personal,"Modernizar los sistemas de auditoría y de selección de personal administrativo, incorporando procedimientos y protocolos modernos de gestión como matrices de riesgo o gestión presupuestaria por objetivos estratégicos, entre otras medidas.",70%,12250-25,Moderniza la gestión institucional y fortalece la probidad y la transparencia en la Fuerzas de Orden y Seguridad Pública.,http://www.senado.cl/appsenado/templates/tramitacion/index.php?boletin_ini=12250-25,,,,1,,,,,,Segundo Tramite,"0,7",,19,1,20,El proyecto de ley asociado se encuentra en segundo trámite constitucional
148,Seguridad Ciudadana,Auditoría financiera contable externa en las policías,Establecer una auditoría financiera contable externa para nuestras policías e implementar un nuevo sistema para denuncias de conductas indebidas dentro de las instituciones policiales.,70%,12250-25,Moderniza la gestión institucional y fortalece la probidad y la transparencia en la Fuerzas de Orden y Seguridad Pública.,http://www.senado.cl/appsenado/templates/tramitacion/index.php?boletin_ini=12250-25,,,,1,,,,,,Segundo Tramite,"0,7",,19,1,20,El proyecto de ley asociado se encuentra en segundo trámite constitucional
149,Seguridad Ciudadana,Personal administrativo civil en las Policías,"Radicar las funciones administrativas (de las Policías) en personal civil especializado, que será elegido por concurso público y sus directivos por los mecanismos de la Alta Dirección Pública, con la sola excepción de la dirección que seguirá el escalafón de orden y seguridad",0%,,,,,,,,,,,,,,0,,,,0,No se conocen proyectos de ley asociados a esta promesa.
150,Seguridad Ciudadana,Establecer el Sistema Táctico de Análisis Delictual (STAD) por ley. ,Establecer el Sistema Táctico de Análisis Delictual (STAD) por ley. ,70%,11705-25,Implementa un Sistema Táctico de Operación Policial,http://www.senado.cl/appsenado/templates/tramitacion/index.php?boletin_ini=11705-25,,,,1,,,,,,Segundo Tramite,"0,7",7,24,,31,El proyecto de ley asociado se encuentra en segundo trámite constitucional
151,Seguridad Ciudadana,Incorporar a los gobiernos locales en la prevención del delito ,"Incorporar a los gobiernos locales en un trabajo conjunto de prevención del delito e introducir cambios legales para que las municipalidades puedan asumir funciones en el área de tránsito, emergencias y faltas relacionadas con las incivilidades a fin de focalizar la labor de Carabineros en prevención del delito",40%,12228-06,"Modifica la ley orgánica constitucional de Municipalidades, fortaleciendo el rol preventivo de los gobiernos locales",http://www.senado.cl/appsenado/templates/tramitacion/index.php?boletin_ini=12228-06,1,,,,,,,,,Primer Tramite,"0,4",,3,,3,El proyecto de ley asociado se encuentra en primer trámite constitucional
152,Seguridad Ciudadana,Nueva Ley de Prevención de la Violencia y el Delito,"Nueva Ley de Prevención de la Violencia y el Delito y, en general, se haga cargo coordinadamente de los factores de riesgo que afectan a la población. Entre otros, involucrará la prevención de la violencia y la deserción en el ámbito escolar y la prevención y rehabilitación en consumo abusivo de drogas y alcohol, con especial énfasis en los adolescentes infractores de ley con problemas de abuso de estas sustancias.",0%,,,,,,,,,,,,,,0,,,,0,No se conocen proyectos de ley asociados a esta promesa.
153,Seguridad Ciudadana,Crear una Estrategia Nacional de Ciberseguridad,"Crear una Estrategia Nacional de Ciberseguridad estableciendo, mediante reforma constitucional, que el ciberespacio nacional es un medioambiente soberano con el mismo estatus del aire, mar y tierra. ",0%,,,,,,,,,,,,,,0,,,,0,No se conocen proyectos de ley asociados a esta promesa.
154,Seguridad Ciudadana,Actualizar la ley de delitos informáticos,Actualizar la ley de delitos informáticos y crear una fuerza de respuesta ante ciberemergencias.,70%,12192-25,"Establece nomas sobre delitos informáticos, deroga la ley N° 19.223 y modifica otros cuerpos legales con el objeto de adecuarlos al convenio de Budapest.",http://www.senado.cl/appsenado/templates/tramitacion/index.php?boletin_ini=12192-25,,,,1,,,,,,Segundo Tramite,"0,7",13,,,13,El proyecto de ley asociado se encuentra en segundo trámite constitucional
