uid,area,titulo,promesa,avance_total,coherencia,,,boletin,titulo_proyecto,link,1° tramite,veto,insistencia,2°-3° tramite,comision_mixta,tribunal_constitucional,aprobacion_presidencial,promulgado,rechazado/retirado,nombre_avance,avance,simple,suma,inmediata,total_urgencias,marginal,parcial_minima,parcial_alta,total,escala_de_coherencia,justificacion_avance,justificacion_nota,ja_porque,jn_porque
22,Justicia y DDHH,Refuerzo de control de malas prácticas y corrupción de privados,"Además, están en tramitación proyectos que refuerzan los controles y endurecen las sanciones a las malas prácticas y corrupción en los negocios. Propusimos que se castigue el delito de corrupción, tráfico de influencias y soborno entre privados",70%,4,,,10155-07,Tipifica el delito de corrupción entre particulares y modifica disposiciones del Código Penal relativas a delitos funcionarios.,https://www.camara.cl/pley/pley_detalle.aspx?prmID=10565&prmBoletin=10155-07,,,,1,,,,,,Segundo Tramite,"0,7",8,4,,12,,,,1,4,"El objetivo principal del proyecto de ley es contribuir a promover y restablecer la confianza en las instituciones públicas y privadas. Para ello, establece un aumento de las penas del delito sobre negociación incompatible e incorporación de una nueva hipótesis, una agravante en el delito de tráfico de influencias, el aumento de las penas del delito de cohecho y el soborno, y se incorpora el delito de corrupción entre particulares.",,El proyecto de ley asociado se encuentra en segundo trámite constitucional,El proyecto de ley es totalmente coherente con la promesa realizada
23,Equidad de Género,Modificación de la actual Ley de Violencia Intrafamiliar,"Modificaremos la actual legislación de violencia intrafamiliar, para actualizar su contenido, aumentar las penas, y ampliar la concepción de violencia contra las mujeres que ocurre en otros espacios, más allá de la relación de pareja o la familia. Patrocinaremos las mociones que contribuyan a la necesaria agilidad que deben tener las tramitaciones judiciales",40%,4,,,11077-07,"Sobre el derecho de las mujeres a una vida libre de violencia
",https://www.camara.cl/pley/pley_detalle.aspx?prmID=11592&prmBoletin=11077-07,1,,,,,,,,,Primer Tramite,"0,4",,,,0,,,,1,4,"Establece modificaciones a la Ley de Violencia Intrafamiliar, modifica el Código Penal con el fin de subsanar las deficiniencias en la actual tipificación del delito de femicidio. Se regula como falta el acoso sexual sin contacto corporal.",,El proyecto de ley asociado se encuentra en primer trámite constitucional,El proyecto de ley es totalmente coherente con la promesa realizada
24,"Medio Ambiente",Mejoramiento en gestión de recursos hídricos,"Es imprescindible mejorar la gestión de los recursos hídricos. Necesitamos que el Estado cuente con mayores facultades de fiscalización y de gestión. Con ese fin, he decido hacer indicaciones a la moción parlamentaria sobre la Dirección General de Aguas",70%,3,70%,2,7543-12,"El proyecto de Ley contempla una modificación al Código Penal, tipificando delitos relacionados a la extracción ilegal de agua. Además establece  ",https://www.camara.cl/pley/pley_detalle.aspx?prmID=7936&prmBoletin=7543-12,,,,1,,,,,,Segundo Tramite,"0,7",9,7,,16,,1,,,3,"El proyecto de ley busca introducir modificaciones al Código de Aguas, dentro de las cuales se destacan: los nuevos derechos de aprovechamiento de aguas dejarán de ser un derecho perpetuo, se establece el consumo humano y de saneamiento como usos prioritarios del agua y se fortalecen las atribuciones de la Dirección General de Aguas, entre otras. Durante el 2016 se puso urgencia y se tramitó el proyecto. Lo que fue finalmente aprobado por la Cámara de Diputados es positivo en este sentido. Sin embargo, el 2017 en el Senado se hicieron nuevas indicaciones, y estas representan un retroceso en temas importantes de potestades de la Dirección General de Aguas, como el caudal ecológico y las ""aguas del minero"". Ahora bien, es un retroceso en comparación con lo aprobado por la Cámara de Diputados, en términos generales sigue siendo mejor que lo que hay. En esta etapa, sin embargo, el avance es menor del necesario y esperado (justificación proporcionada por ONG FIMA).",,"La promesa cuenta con 2 proyectos de ley asociados en distintos trámites constitucionales, el avance total de la promesa es el promedio del avance de esos proyectos",La promesa cuenta con 2 proyectos de ley asociados. La coherencia total de esta promesa corresponde a el promedio de las coherencias de esos proyectos
24,"Medio Ambiente",Mejoramiento en gestión de recursos hídricos,,,,70%,4,8149-09,Introduce modificaciones al marco normativo que rige las aguas en materia de fiscalización y sanciones.,https://www.camara.cl/pley/pley_detalle.aspx?prmID=8548&prmBoletin=8149-09,,,,1,,,,,,Segundo Tramite,"0,7",,12,,12,,,,1,4,"El proyecto de ley contempla una modificación al Código Penal, tipificando delitos relacionados a la extracción ilegal de agua. Además se establece la modificación del artículo 173 del Código de Aguas, aumentando el límite de multas y el perfeccionamiento de la capacidad fiscalizadora de la Dirección General de Aguas. ",,"La promesa cuenta con 2 proyectos de ley asociados en distintos trámites constitucionales, el avance total de la promesa es el promedio del avance de esos proyectos",La promesa cuenta con 2 proyectos de ley asociados. La coherencia total de esta promesa corresponde a el promedio de las coherencias de esos proyectos
25,Obras Públicas,Creación de Dirección General de Concesiones,"Cumplimos 20 años desde que concesionamos la primera obra pública y llegó el momento de perfeccionar la institucionalidad para los próximos 20 años. Nuestro deber es garantizar que las obras concesionadas serán diseñadas y ejecutadas con el mayor rigor y calidad. A eso apunta la creación de la Dirección General de Concesiones, actualmente en discusión en este Congreso",70%,4,,,10126-15,Crea la Dirección General de Concesiones de Obras Públicas y modifica las normas que señala,https://www.camara.cl/pley/pley_detalle.aspx?prmID=10549&prmBoletin=10126-15,,,,1,,,,,,Segundo Tramite,"0,7",1,8,,9,,,,1,4,"Para el fortalecimiento de los procesos de negocio asociados a las concesiones, se plantea que la institucionalidad orgánica recoja las buenas prácticas y procesos de la experiencia de la Coordinación de Concesiones de Obras Públicas, alojando en la Dirección General de Concesiones las funciones y atribuciones que permitan desarrollar todo el proceso de la infraestructura concesionada.",,El proyecto de ley asociado se encuentra en segundo trámite constitucional,El proyecto de ley es totalmente coherente con la promesa realizada
26,Obras Públicas,Creación de Fondo de Estructura,"Y hemos propuesto la creación del Fondo de Infraestructura, que con un potencial de hasta nueve mil millones de dólares, busca facilitar el financiamiento de nuevas obras acompañando al sector privado",40%,4,,,10647-09,"Crea una sociedad anónima del Estado denominada ""Fondo de estructura S.A.""",https://www.camara.cl/pley/pley_detalle.aspx?prmID=11074&prmBoletin=10647-09,1,,,,,,,,,Primer Tramite,"0,4",,9,,9,,,,1,4,"El proyecto de ley crea una sociedad anónima del Estado denominada “Fondo de Infraestructura S.A.”, cuyo objeto será la construcción, ampliación, reparación, conservación, explotación, desarrollo, financiamiento o inversión referidas a proyectos de infraestructura, incluidos servicios anexos a éstos. Esta sociedad contemplará una participación del capital social del 99% por parte del Fisco y una participación de 1% de la Corporación de Fomento de la Producción (CORFO).",,El proyecto de ley asociado se encuentra en primer trámite constitucional,El proyecto de ley es totalmente coherente con la promesa realizada
27,Salud,Creación de mecanismo solidario para madres y padres de hijos accidentados o enfermos graves,"Hoy les anuncio que crearemos un mecanismo solidario para las madres y padres trabajadores en caso que sus hijos e hijas menores de quince años sufran un accidente o enfermedad grave y de alto riesgo vital. El envío de este proyecto de Ley busca que puedan prestarles atención, acompañamiento o cuidado personal durante su enfermedad, tratamiento o rehabilitación",100%,4,,,11161-13,Crea el fondo que financiará el seguro para el acompañamiento de los niños y niñas que indica,https://www.camara.cl/pley/pley_detalle.aspx?prmID=11673&prmBoletin=11161-13,,,,,,,,1,,Promulgado,1,,,2,2,,,,1,4,"Este proyecto de ley busca constituir las bases de un nuevo componente del Sistema de Protección Social: la creación de un fondo que financie un seguro para las madres y padres trabajadores de hijos e hijas menores de edad, afectados por una condición grave de salud y de alto riesgo vital, con el objeto que puedan ausentarse justificadamente de su trabajo durante un tiempo determinado, para prestarles atención, acompañamiento o cuidado personal, recibiendo durante ese período una prestación económica que reemplaza total o parcialmente su remuneración mensual, la que será financiada con cargo al seguro.",,El proyecto de ley asociado se encuentra despachado y es Ley de la República,El proyecto de ley es totalmente coherente con la promesa realizada
28,Salud,Plan de formación de médicos especialistas y odontólogos,"Por eso hemos puesto en marcha un plan para que mil 480 médicos se incorporen a la Atención Primaria y se formen cuatro mil nuevos médicos especialistas y odontólogos. El Plan incluye el ingreso, formación y su permanencia en el sistema público. Lo estamos haciendo en un trabajo conjunto con las universidades para aumentar a mil el número de médicos especialistas y odontólogos formados por año ",100%,4,,,10490-11,"Modifica la ley N° 15.076, para fortalecer el proceso de ingreso y formación en especialidades médicas y odontológicas, y la ley N° 19.664, con el objeto de otorgar beneficios al personal afecto a dicho texto legal
",https://www.camara.cl/pley/pley_detalle.aspx?prmID=10914&prmBoletin=10490-11,,,,,,,,1,,Promulgado,1,2,10,,12,,,,1,4,"El proyecto de ley tiene dos grandes objetos. En primer lugar, mediante las modificaciones a la ley N° 15.076 se pretende contribuir a mejorar los estímulos que fortalezcan el proceso de ingreso y de formación en especialidades médicas y odontológicas, previo a su ingreso a la especialidad, para hacer más atractiva esta etapa de la vida profesional. En segundo lugar, se perfecciona la carrera y se crean nuevos beneficios económicos para el personal afecto a la ley Nº 19.664.",,El proyecto de ley asociado se encuentra despachado y es Ley de la República,El proyecto de ley es totalmente coherente con la promesa realizada
29,Trabajo y Previsión Social,Fortalecimiento de organizaciones sindicales y negociaciones sociales,"Buscamos relaciones laborales justas, que propicien metas estratégicas compartidas entre trabajadores y empresarios. Por tal razón, estamos comprometidos en fortalecer las organizaciones sindicales y hacer que las negociaciones colectivas sean más equilibradas",100%,2,,,9835-13,"Moderniza el sistema de relaciones laborales, introduciendo  modificaciones al Código del Trabajo.",https://www.camara.cl/pley/pley_detalle.aspx?prmID=10248&prmBoletin=9835-13,,,,,,,,1,,Promulgado,1,,,1,1,,1,,,2,"El proyecto realiza diversas modificaciones, tales como: ampliación de la cobertura de la negociación colectiva a trabajadores que hoy están excluidos de ejercer este derecho, simplificación del procedimiento de negociación colectiva reglada, ampliación de materias de la negociación colectiva, equilibrio de las partes en el proceso negociador en relación al derecho a huelga, entre otras. Sin embargo, la titularidad sindical no prosperó, elemento considerado fundamental para dotar de representatividad a los sindicatos y fortalcerlos.",,El proyecto de ley asociado se encuentra despachado y es Ley de la República,El proyecto de ley es marginalmente coherente con la promesa realizada
30,Trabajo y Previsión Social,Modificación de normas especiales para temporeros y temporeras,Retomaremos el diálogo tripartito para presentar este año un proyecto de ley que modifica las normas especiales para los temporeros y temporeras,0%,1,,,,,,,,,,,,,,,,0,,,,0,,,,,1,,,No se conocen proyectos de ley asociados a esta promesa,No se conocen proyectos de ley asociados a esta promesa
31,Trabajo y Previsión Social,Creación AFP estatal,"Vamos a acelerar la tramitación del proyecto que crea la AFP estatal, que traerá más competencia, menores costos de administración y mejor cobertura",40%,4,,,9399-13,Crea una Administradora de Fondos de Pensiones del Estado,https://www.camara.cl/pley/pley_detalle.aspx?prmID=9810&prmBoletin=9399-13,1,,,,,,,,,Primer Tramite,"0,4",3,,,3,,,,1,4,"El proyecto crea una AFP estatal con el objeto de aumentar la cobertura en materia de pensiones de los trabajadores de menores rentas, trabajadores independientes y trabajadores de zonas geográficas alejadas de centros urbanos, así como introducir mayor competencia en el Sistema de las AFP.",,El proyecto de ley asociado se encuentra en primer trámite constitucional,El proyecto de ley es totalmente coherente con la promesa realizada
32,Trabajo y Previsión Social,Inclusión laboral de personas con discapacidad,"Enviaremos un proyecto de Ley, basado en propuestas de los parlamentarios, sobre inclusión laboral de las personas con capacidades diferentes. Nada justifica que discapacitados reciban menos que el salario mínimo como remuneración. Estableceremos, además, un porcentaje de contrataciones para personas en situación de discapacidad en las instituciones y empresas públicas",90%,3,,,7855-13,"Modifica ley N° 20.422, para establecer reserva legal de empleos, para personas con discapacidad.",https://www.camara.cl/pley/pley_detalle.aspx?prmID=8255&prmBL=7855-13,,,,,,,1,,,Aprobación Presidencial,"0,9",1,16,3,20,,,1,,3,"El proyecto de Ley establece que toda unidad laboral, ya sea del sector público o privado, deberá reservar al menos un 2% de sus puestos de trabajo para trabajadores que, siendo idóneos para la función, posean alguna discapacidad de acuerdo al artículo 5 de la presente ley. Sin embargo, no se contemplan medidas en torno a remuneraciones.",,El proyecto de ley se encuentra en proceso de ser promulgado,El proyecto de ley es parcialmente coherente con la promesa realizada
33,Transporte y Telecomunicaciones,Garantias para velocidad mínima de internet,"También queremos garantizar una velocidad mínima de acceso a Internet a través de un proyecto que está discutiendo este Congreso, porque no es posible que los chilenos paguen por un servicio que no reciben",70%,4,,,"
8584-15","Modifica Ley General de Telecomunicaciones, para establecer la obligación de una velocidad mínima garantizada, de acceso a Internet",https://www.camara.cl/pley/pley_detalle.aspx?prmID=8986&prmBoletin=8584-15,,,,,1,,,,,Comisión Mixta,"0,7",13,16,,29,,,,1,4,"El proyecto de Ley modifica la Ley General de Telecomunicaciones, para establecer la obligación de una velocidad mínima garantizada de acceso a Internet. Además, establece que estará prohibido establecer en ofertas comerciales condiciones de degradación de velocidad de acceso a Internet, en base a la utilización de sus servicios.",,El proyecto de ley asociado se encuentra en segundo trámite constitucional,El proyecto de ley es totalmente coherente con la promesa realizada
34,Economía y Comercio,Perfeccionamiento de Ley de Pesca,"Nuestro compromiso es perfeccionar la legislación pesquera, para asegurar la sustentabilidad
de la actividad y el resguardo de los intereses de todos los chilenos
",0%,1,,,,,,,,,,,,,,,,0,,,,0,,,,,1,,,No se conocen proyectos de ley asociados a esta promesa,No se conocen proyectos de ley asociados a esta promesa
35,Economía y Comercio,Estabilización del precio del cobre,Continuaremos aplicando el nuevo mecanismo de estabilización del precio del cobre por el tiempo que sea necesario,40%,4,,,10995-08,Crea un mecanismo de estabilización del precio del cobre para la Pequeña Minería,https://www.camara.cl/pley/pley_detalle.aspx?prmID=11507&prmBoletin=10995-08,1,,,,,,,,,Primer Tramite,"0,4",1,,,1,,,,1,4,"El proyecto de ley establece un mecanismo que operará a través de un Fondo de Estabilización del Precio del Cobre para la Pequeña Minería, que será administrado por ENAMI, y cuyo objeto exclusivo será atenuar las fluctuaciones que experimente el precio del cobre para los beneficiarios directos.",,El proyecto de ley asociado se encuentra en primer trámite constitucional,El proyecto de ley es totalmente coherente con la promesa realizada
36,"Democracia",Actualización de Constitución,"Pero nuestra convivencia necesita además contar con una Constitución moderna, actualizada y reconocida por todos como propia",40%,3,,,11173-07,Modifica el Capítulo XV de la Constitución Política de la República,https://www.camara.cl/pley/pley_detalle.aspx?prmID=11685&prmBoletin=11173-07,1,,,,,,,,,Primer Tramite,"0,4",,,,0,,,1,,3,"La propuesta establece una norma que permite elaborar una nueva Constitución en una sede constituyente convocada para tal efecto, en el marco de la institucionalidad vigente. Esto, ya que la actual Constitución no contempla un mecanismo específico para su reemplazo total. Sin embargo, no establece plazos para el cambio constitucional.",,El proyecto de ley asociado se encuentra en primer trámite constitucional,El proyecto de ley es parcialmente coherente con la promesa realizada
37,Infancia y Juventud,Servicio Nacional de Protección Especializada de Niños y Niñas,Creación de un servicio de reinserción social juvenil y transformaremos el Sename en el Servicio Nacional de Protección de Menores,40%,4,,,11174-07,"Crea el Servicio Nacional de Reinserción Social Juvenil e introduce modificaciones a la ley N° 20.084, sobre responsabilidad penal de adolescentes, y a otras normas que indica",https://www.camara.cl/pley/pley_detalle.aspx?prmID=11687&prmBoletin=11174-07,1,,,,,,,,,Primer Tramite,"0,4",,,,0,,,,1,4,"Es un excelente proyecto. pero hay que mejorar algunos puntos. En lo medular es un proyecto serio, fundado y bien hecho (justificación proporcionada por Corporación Opción).",,El proyecto de ley asociado se encuentra en primer trámite constitucional,El proyecto de ley es totalmente coherente con la promesa realizada
